{
  "$schema": "https://json-schema.org/draft/2020-12/schema",
  "$id": "urn:decision-ripple:decision:1",
  "title": "Decision Ripple decision record",
  "type": "object",
  "required": ["schema_version", "id", "title", "statement", "rationale", "tags"],
  "properties": {
    "schema_version": {"const": 1},
    "id": {"type": "string", "minLength": 1},
    "title": {"type": "string", "minLength": 1},
    "statement": {"type": "string", "minLength": 1},
    "rationale": {"type": "string"},
    "tags": {"type": "array", "uniqueItems": true, "items": {"type": "string", "minLength": 1}}
  }
}
